{
  "schemaVersion": "1.0",
  "id": "LIT-O-FIND-001",
  "domain": "LITERACY",
  "curriculumId": "LIT-G2-O",
  "sourceType": "ADAPTED",
  "sourceRef": {
    "sourceCode": "TR-03",
    "pageStart": 49,
    "pageEnd": 50
  },
  "title": "O ve o Harflerini Bul",
  "learningLevel": "GRADE_1",
  "activityType": "FIND_LETTER",
  "instruction": {
    "text": "O ve o harflerinin hepsini bul.",
    "audioId": "aud_lit_o_find_001_instruction",
    "voiceProfile": "TEACHER_PHONICS",
    "replayAllowed": true
  },
  "learningTarget": {
    "conceptId": "LIT-G2-O",
    "targetSymbol": "o",
    "allowedLetters": [
      "a",
      "n",
      "e",
      "t",
      "i",
      "l",
      "o"
    ]
  },
  "prerequisites": [
    "LIT-O-INTRO-001"
  ],
  "interaction": {
    "mode": "MULTI_TAP",
    "retryStrategy": "HIGHLIGHT_HINT",
    "options": [
      {
        "id": "opt_1",
        "label": "O",
        "value": "O",
        "correct": true
      },
      {
        "id": "opt_2",
        "label": "E",
        "value": "E",
        "correct": false
      },
      {
        "id": "opt_3",
        "label": "o",
        "value": "o",
        "correct": true
      },
      {
        "id": "opt_4",
        "label": "L",
        "value": "L",
        "correct": false
      },
      {
        "id": "opt_5",
        "label": "İ",
        "value": "İ",
        "correct": false
      },
      {
        "id": "opt_6",
        "label": "O",
        "value": "O",
        "correct": true
      }
    ]
  },
  "assets": {
    "visualIds": [],
    "avatarUse": {
      "enabled": true,
      "role": "GUIDE",
      "pose": "point_right"
    }
  },
  "audio": {
    "extraAudioIds": []
  },
  "animation": {
    "entry": "SLIDE_RIGHT",
    "success": "SOFT_GLOW",
    "retry": "HIGHLIGHT_HINT",
    "reducedMotionFallback": "FADE_IN"
  },
  "feedback": {
    "successAudioId": "aud_common_success_01",
    "retryAudioId": "aud_common_retry_01",
    "successSfx": "SFX_SUCCESS_CHIME",
    "retrySfx": "SFX_RETRY_SOFT",
    "punitive": false
  },
  "safety": {
    "reviewed": true,
    "prohibitedContentPresent": false,
    "externalUrl": false,
    "ads": false,
    "purchase": false
  },
  "progression": {
    "completionRule": "COMPLETE_ON_SUCCESS",
    "repeatEligible": true,
    "unlocks": [
      "LIT-O-SOUND-001"
    ]
  },
  "metadata": {
    "locale": "tr-TR",
    "authoringVersion": 1
  }
}
