{
  "schemaVersion": "1.0",
  "id": "ACT-MAT-MASS-05",
  "domain": "MATHEMATICS",
  "curriculumId": "MAT-MASS-05",
  "sourceType": "ADAPTED",
  "sourceRef": {
    "sourceCode": "MA-03",
    "pageStart": 28,
    "pageEnd": 28
  },
  "title": "Ağır nesneleri izleyerek yol bulma",
  "learningLevel": "GRADE_1",
  "activityType": "COMPARE_MASS",
  "instruction": {
    "text": "Daha ağır nesneyi seç.",
    "audioId": "aud_act_mat_mass_05_instruction",
    "voiceProfile": "TEACHER_MATH",
    "replayAllowed": true
  },
  "learningTarget": {
    "conceptId": "MAT-MASS-05",
    "targetSymbol": "kitap, tüy, pamuk"
  },
  "prerequisites": [
    "MAT-MASS-04"
  ],
  "interaction": {
    "mode": "TAP",
    "retryStrategy": "HIGHLIGHT_HINT",
    "options": [
      {
        "id": "opt_1",
        "label": "kitap",
        "value": "kitap",
        "correct": true
      },
      {
        "id": "opt_2",
        "label": "tüy",
        "value": "tüy",
        "correct": false
      },
      {
        "id": "opt_3",
        "label": "pamuk",
        "value": "pamuk",
        "correct": false
      }
    ]
  },
  "assets": {
    "visualIds": [],
    "avatarUse": {
      "enabled": true,
      "role": "GUIDE",
      "pose": "thinking"
    }
  },
  "audio": {
    "extraAudioIds": []
  },
  "animation": {
    "entry": "FADE_IN",
    "success": "SOFT_GLOW",
    "retry": "HIGHLIGHT_HINT",
    "reducedMotionFallback": "FADE_IN"
  },
  "feedback": {
    "successAudioId": "aud_common_success_01",
    "retryAudioId": "aud_common_retry_01",
    "successSfx": "SFX_SUCCESS_CHIME",
    "retrySfx": "SFX_RETRY_SOFT",
    "punitive": false
  },
  "safety": {
    "reviewed": false,
    "prohibitedContentPresent": false,
    "externalUrl": false,
    "ads": false,
    "purchase": false
  },
  "progression": {
    "completionRule": "COMPLETE_ON_SUCCESS",
    "repeatEligible": true,
    "unlocks": []
  },
  "metadata": {
    "locale": "tr-TR",
    "authoringVersion": 1,
    "notes": "Kaynak ölçme etkinliğinin özgün dijital uyarlaması."
  }
}
