{
  "schemaVersion": "1.0",
  "id": "ACT-EXT-MUL-01",
  "domain": "MATHEMATICS",
  "curriculumId": "EXT-MUL-01",
  "sourceType": "EXTENSION",
  "sourceRef": null,
  "title": "Çarpma öğretimi",
  "learningLevel": "GRADE_1",
  "activityType": "GROUP_OBJECTS",
  "instruction": {
    "text": "3 grupta 2'şer nesne var. Toplamı seç.",
    "audioId": "aud_act_ext_mul_01_instruction",
    "voiceProfile": "TEACHER_MATH",
    "replayAllowed": true
  },
  "learningTarget": {
    "conceptId": "EXT-MUL-01",
    "targetSymbol": "3 × 2"
  },
  "prerequisites": [
    "EXT-ADD-01",
    "MAT-SKIP-02"
  ],
  "interaction": {
    "mode": "TAP",
    "retryStrategy": "HIGHLIGHT_HINT",
    "options": [
      {
        "id": "opt_1",
        "label": "5",
        "value": "5",
        "correct": false
      },
      {
        "id": "opt_2",
        "label": "6",
        "value": "6",
        "correct": true
      },
      {
        "id": "opt_3",
        "label": "8",
        "value": "8",
        "correct": false
      }
    ]
  },
  "assets": {
    "visualIds": [],
    "avatarUse": {
      "enabled": true,
      "role": "GUIDE",
      "pose": "thinking"
    }
  },
  "audio": {
    "extraAudioIds": []
  },
  "animation": {
    "entry": "SOFT_DROP",
    "success": "BOUNCE_ONCE",
    "retry": "SOFT_SHAKE",
    "reducedMotionFallback": "FADE_IN"
  },
  "feedback": {
    "successAudioId": "aud_common_success_01",
    "retryAudioId": "aud_common_retry_01",
    "successSfx": "SFX_SUCCESS_CHIME",
    "retrySfx": "SFX_RETRY_SOFT",
    "punitive": false
  },
  "safety": {
    "reviewed": true,
    "prohibitedContentPresent": false,
    "externalUrl": false,
    "ads": false,
    "purchase": false
  },
  "progression": {
    "completionRule": "COMPLETE_ON_SUCCESS",
    "repeatEligible": true,
    "unlocks": []
  },
  "metadata": {
    "locale": "tr-TR",
    "authoringVersion": 1,
    "notes": "Mevcut PDF setinde bağımsız sistematik işlem öğretimi bulunmadığından EXTENSION olarak tutulur."
  }
}
