{
  "schemaVersion": "1.0",
  "id": "GAME-LIT-HUNT-001",
  "domain": "LITERACY",
  "curriculumId": "LIT-G2-U",
  "sourceType": "ADAPTED",
  "sourceRef": {
    "sourceCode": "TR-03",
    "pageStart": 92,
    "pageEnd": 112
  },
  "title": "Harf Avı",
  "learningLevel": "GRADE_1",
  "activityType": "FIND_TARGET_SYMBOL",
  "instruction": {
    "text": "u harflerinin hepsini bul.",
    "audioId": "aud_game_lit_hunt_001_instruction",
    "voiceProfile": "TEACHER_PHONICS",
    "replayAllowed": true
  },
  "learningTarget": {
    "conceptId": "LIT-G2-U",
    "targetSymbol": "u",
    "allowedLetters": [
      "a",
      "n",
      "e",
      "t",
      "i",
      "l",
      "o",
      "k",
      "u"
    ]
  },
  "prerequisites": [
    "LIT-G2-U"
  ],
  "interaction": {
    "mode": "MULTI_TAP",
    "retryStrategy": "HIGHLIGHT_HINT",
    "options": [
      {
        "id": "opt_1",
        "label": "u",
        "value": "u",
        "correct": true
      },
      {
        "id": "opt_2",
        "label": "n",
        "value": "n",
        "correct": false
      },
      {
        "id": "opt_3",
        "label": "U",
        "value": "U",
        "correct": true
      },
      {
        "id": "opt_4",
        "label": "o",
        "value": "o",
        "correct": false
      },
      {
        "id": "opt_5",
        "label": "u",
        "value": "u",
        "correct": true
      },
      {
        "id": "opt_6",
        "label": "k",
        "value": "k",
        "correct": false
      }
    ]
  },
  "assets": {
    "visualIds": [],
    "avatarUse": {
      "enabled": true,
      "role": "GUIDE",
      "pose": "smile"
    }
  },
  "audio": {
    "extraAudioIds": []
  },
  "animation": {
    "entry": "POP_IN",
    "success": "SMALL_STARS",
    "retry": "HIGHLIGHT_HINT",
    "reducedMotionFallback": "FADE_IN"
  },
  "feedback": {
    "successAudioId": "aud_common_success_01",
    "retryAudioId": "aud_common_retry_01",
    "successSfx": "SFX_SUCCESS_CHIME",
    "retrySfx": "SFX_RETRY_SOFT",
    "punitive": false
  },
  "safety": {
    "reviewed": false,
    "prohibitedContentPresent": false,
    "externalUrl": false,
    "ads": false,
    "purchase": false
  },
  "progression": {
    "completionRule": "COMPLETE_ON_SUCCESS",
    "repeatEligible": true,
    "unlocks": []
  },
  "metadata": {
    "locale": "tr-TR",
    "authoringVersion": 1,
    "notes": "Build Step 10 pedagojik mini oyun; bağımlılık döngüsü, puan baskısı veya rastgele ödül içermez."
  }
}
