{
  "schemaVersion": "1.0",
  "id": "LIT-N-SOUND-001",
  "domain": "LITERACY",
  "curriculumId": "LIT-G1-N",
  "sourceType": "ADAPTED",
  "sourceRef": {
    "sourceCode": "TR-02",
    "pageStart": 30,
    "pageEnd": 33
  },
  "title": "n Sesini Bul",
  "learningLevel": "GRADE_1",
  "activityType": "FIND_SOUND_OBJECT",
  "instruction": {
    "text": "İsminde n sesi olan varlıkları seç.",
    "audioId": "aud_lit_n_sound_001_instruction",
    "voiceProfile": "TEACHER_PHONICS",
    "replayAllowed": true
  },
  "learningTarget": {
    "conceptId": "LIT-G1-N",
    "targetSymbol": "n",
    "allowedLetters": [
      "a",
      "n"
    ]
  },
  "prerequisites": [
    "LIT-N-FIND-001"
  ],
  "interaction": {
    "mode": "MULTI_TAP",
    "retryStrategy": "HIGHLIGHT_HINT",
    "options": [
      {
        "id": "obj_1",
        "label": "balon",
        "value": "balon",
        "correct": true
      },
      {
        "id": "obj_2",
        "label": "telefon",
        "value": "telefon",
        "correct": true
      },
      {
        "id": "obj_3",
        "label": "aslan",
        "value": "aslan",
        "correct": true
      },
      {
        "id": "obj_4",
        "label": "araba",
        "value": "araba",
        "correct": false
      },
      {
        "id": "obj_5",
        "label": "masa",
        "value": "masa",
        "correct": false
      }
    ]
  },
  "assets": {
    "visualIds": [],
    "avatarUse": {
      "enabled": true,
      "role": "GUIDE",
      "pose": "point_right"
    }
  },
  "audio": {
    "extraAudioIds": []
  },
  "animation": {
    "entry": "SLIDE_RIGHT",
    "success": "SOFT_GLOW",
    "retry": "HIGHLIGHT_HINT",
    "reducedMotionFallback": "FADE_IN"
  },
  "feedback": {
    "successAudioId": "aud_common_success_01",
    "retryAudioId": "aud_common_retry_01",
    "successSfx": "SFX_SUCCESS_CHIME",
    "retrySfx": "SFX_RETRY_SOFT",
    "punitive": false
  },
  "safety": {
    "reviewed": true,
    "prohibitedContentPresent": false,
    "externalUrl": false,
    "ads": false,
    "purchase": false
  },
  "progression": {
    "completionRule": "COMPLETE_ON_SUCCESS",
    "repeatEligible": true,
    "unlocks": [
      "LIT-N-TRACE-001"
    ]
  },
  "metadata": {
    "locale": "tr-TR",
    "authoringVersion": 1
  }
}
