{
  "schemaVersion": "1.0",
  "id": "PRE-TRACE-COPY-001",
  "domain": "PREWRITING",
  "curriculumId": "PRE-TRACE-04",
  "sourceType": "ADAPTED",
  "sourceRef": {
    "sourceCode": "TR-01",
    "pageStart": 22,
    "pageEnd": 28
  },
  "title": "Çizgiyi Tekrarla",
  "learningLevel": "PRESCHOOL_START",
  "activityType": "TRACE_PATH",
  "instruction": {
    "text": "Eğri yolu dikkatlice takip et ve çizgiyi tamamla.",
    "audioId": "aud_pre_trace_copy_001_instruction",
    "voiceProfile": "TEACHER_WARM",
    "replayAllowed": true
  },
  "learningTarget": {
    "conceptId": "PRE-TRACE-04",
    "targetSymbol": "CURVE_COPY"
  },
  "prerequisites": [
    "PRE-TRACE-03"
  ],
  "interaction": {
    "mode": "TRACE",
    "retryStrategy": "HIGHLIGHT_HINT"
  },
  "assets": {
    "visualIds": [],
    "avatarUse": {
      "enabled": true,
      "role": "GUIDE",
      "pose": "point_right"
    }
  },
  "audio": {
    "extraAudioIds": []
  },
  "animation": {
    "entry": "FADE_IN",
    "success": "SOFT_GLOW",
    "retry": "HIGHLIGHT_HINT",
    "reducedMotionFallback": "FADE_IN"
  },
  "feedback": {
    "successAudioId": "aud_common_success_01",
    "retryAudioId": "aud_common_retry_01",
    "successSfx": "SFX_SUCCESS_CHIME",
    "retrySfx": "SFX_RETRY_SOFT",
    "punitive": false
  },
  "safety": {
    "reviewed": true,
    "prohibitedContentPresent": false,
    "externalUrl": false,
    "ads": false,
    "purchase": false
  },
  "progression": {
    "completionRule": "COMPLETE_ON_SUCCESS",
    "repeatEligible": true,
    "unlocks": [
      "PRE-VIS-01"
    ]
  },
  "metadata": {
    "locale": "tr-TR",
    "authoringVersion": 1,
    "notes": "TR-01 kılavuzdan sonra benzer çizgiyi yeniden üretme mantığının başlangıç uyarlaması."
  }
}
